<?xml version="1.0" encoding="UTF-8"?>
<?xml-stylesheet type="text/xsl" href="ShareHolders.xsl"?>
<cbrtns:cbrt xmlns:cbrtns="http://www.example.org/cbrt" xmlns:xsi="http://www.w3.org/2001/XMLSchema-instance" xsi:schemaLocation="http://www.example.org/cbrt cbrt.xsd ">
	<Governor EmployeeNumber="00001" SSN="0000000001">
		<FirstName>Murat</FirstName>
		<LastName>Çetinkaya</LastName>
		<Title>Mr.</Title>
		<AssignmentDate>2016-04-01</AssignmentDate>
		<Graduate>Economics</Graduate>
		<AssignmentCount>1</AssignmentCount>
	</Governor>
	<DeputyGovernor EmployeeNumber="00002" SSN="0000000002">
		<FirstName>Erkan</FirstName>
		<LastName>Kilimci</LastName>
		<Title>Mr.</Title>
		<AssignmentDate>2016-05-16</AssignmentDate>
		<Graduate>Economics</Graduate>
	</DeputyGovernor>
	<MPC_member SSN="0000000003">
		<FirstName>Abdullah</FirstName>
		<LastName>Yavaş</LastName>
		<AssignmentDate>2008-03-11</AssignmentDate>
	</MPC_member>
	<BoardMember SSN="0000000004">
		<FirstName>Ahmet Faruk</FirstName>
		<LastName>Aysan</LastName>
	</BoardMember>
	<AuditCommunityMember EmployeeNumber="00003" SSN="0000000005">
		<FirstName>Murat </FirstName>
		<LastName>Uysal</LastName>
		<Title>Mr.</Title>
		<AssignmentDate>2016-06-09</AssignmentDate>
	</AuditCommunityMember>
	<ExecCommunityMember EmployeeNumber="00004" SSN="0000000006">
		<FirstName>Emrah</FirstName>
		<LastName>Şener</LastName>
		<Title>Mr.</Title>
		<AssignmentDate>2016-08-02</AssignmentDate>
	</ExecCommunityMember>
	<Client>
		<Person SSN="0000000007">
			<FirstName>Mehmet</FirstName>
			<LastName>Yılmaz</LastName>
		</Person>
	</Client>
	<ShareHolder>
		<A_type>
			<CompanyName>Hazine</CompanyName>
			<Country>TR</Country>
		</A_type>
	</ShareHolder>
	<ShareHolder>
		<B_type>
			<CompanyName>TCMB Mensupları Sosyal Güvenlik ve Yardımlaşma Sandığı Vakfı</CompanyName>
			<Country>TR</Country>
		</B_type>
	</ShareHolder>
	<ShareHolder>
		<B_type>
			<CompanyName>T.C. Ziraat Bankası</CompanyName>
			<Country>TR</Country>
		</B_type>
	</ShareHolder>
	<ShareHolder>
		<B_type>
			<CompanyName>Türkiye Garanti Bankası</CompanyName>
			<Country>TR</Country>
		</B_type>
	</ShareHolder>
	<ShareHolder>
		<B_type>
			<CompanyName>Türkiye İş Bankası</CompanyName>
			<Country>TR</Country>
		</B_type>
	</ShareHolder>
	<ShareHolder>
		<B_type>
			<CompanyName>Türkiye Halk Bankası</CompanyName>
			<Country>TR</Country>
		</B_type>
	</ShareHolder>
	<ShareHolder>
		<B_type>
			<CompanyName>Yapı Kredi Bankası</CompanyName>
			<Country>TR</Country>
		</B_type>
	</ShareHolder>
	<ShareHolder>
		<B_type>
			<CompanyName>Akbank</CompanyName>
			<Country>TR</Country>
		</B_type>
	</ShareHolder>
	<ShareHolder>
		<B_type>
			<CompanyName>Türkiye Ekonomi Bankası (TEB)</CompanyName>
			<Country>TR</Country>
		</B_type>
	</ShareHolder>
	<ShareHolder>
		<B_type>
			<CompanyName>T.C. Sosyal Güvenlik Kurumu</CompanyName>
			<Country>TR</Country>
		</B_type>
	</ShareHolder>
	<ShareHolder>
		<B_type>
			<CompanyName>Türkiye Kızılay Derneği</CompanyName>
			<Country>TR</Country>
		</B_type>
	</ShareHolder>
	<ShareHolder>
		<C_type>
			<CompanyName>ING Bank</CompanyName>
			<Country>NE</Country>
		</C_type>
	</ShareHolder>
	<ShareHolder>
		<D_type SSN="0000000099">
			<FirstName>Adnan</FirstName>
			<LastName>Aktar</LastName>
		</D_type>
	</ShareHolder>
	<Branch branchID="2">
		<branchLocation>Ankara</branchLocation>
		<branchName>Ankara Şubesi</branchName>
		<telNo>(0312) 507 7301</telNo>
		<address>Atatürk Bulvarı No:4 06100 Ulus Ankara</address>
		<employee EmployeeNumber="00006" SSN="0000000009">
			<FirstName>Yusuf</FirstName>
			<LastName>Enhoş</LastName>
			<Title>Mr.</Title>
			<AssignmentDate>2001-01-01</AssignmentDate>
		</employee>
	</Branch>
	<Employee>
		<Contractual EmployeeNumber="00006" SSN="0000000009">
			<FirstName>Ali</FirstName>
			<LastName>Korkmaz</LastName>
			<Title>Mr.</Title>
			<AssignmentDate>2001-01-01</AssignmentDate>
			<ContractExpDate>2016-12-31</ContractExpDate>
		</Contractual>
	</Employee>
</cbrtns:cbrt>
